SUID;adjustedPValue_Bingo-gbm-unique;description_Bingo-gbm-unique;N_Bingo-gbm-unique;name;nn_Bingo-gbm-unique;nodeFillColor_Bingo-gbm-unique;nodeFontSize_Bingo-gbm-unique;nodeSize_Bingo-gbm-unique;nodeType_Bingo-gbm-unique;pValue_Bingo-gbm-unique;selected;shared name;X_Bingo-gbm-unique;xx_Bingo-gbm-unique
120640;2.91E-01;positive regulation of osteoblast differentiation;14305;45669;26;0.535550884;14;4;ellipse;1.31E-01;false;45669;1087;4
120660;2.91E-01;negative regulation of osteoblast differentiation;14305;45668;17;0.535550884;14;3.464101615;ellipse;1.34E-01;false;45668;1087;3
120721;2.91E-01;nuclear envelope disassembly;14305;51081;2;0.535550884;14;2;ellipse;1.46E-01;false;51081;1087;1
120822;2.91E-01;protein complex disassembly;14305;43241;17;0.535550884;14;3.464101615;ellipse;1.34E-01;false;43241;1087;3
120848;2.91E-01;chromosome condensation;14305;30261;26;0.535550884;14;4;ellipse;1.31E-01;false;30261;1087;4
121215;2.91E-01;hydrogen sulfide metabolic process;14305;70813;2;0.535550884;14;2;ellipse;1.46E-01;false;70813;1087;1
121303;2.91E-01;PML body organization;14305;30578;2;0.535550884;14;2;ellipse;1.46E-01;false;30578;1087;1
121634;2.91E-01;uropod organization;14305;32796;2;0.535550884;14;2;ellipse;1.46E-01;false;32796;1087;1
111952;2.96E-01;neuron migration;14305;1764;58;0.528276002;14;5.291502622;ellipse;1.49E-01;false;1764;1087;7
111605;3.02E-01;organ growth;14305;35265;18;0.520591832;14;3.464101615;ellipse;1.52E-01;false;35265;1087;3
111791;3.02E-01;T cell homeostasis;14305;43029;18;0.520591832;14;3.464101615;ellipse;1.52E-01;false;43029;1087;3
112331;3.02E-01;myoblast differentiation;14305;45445;18;0.520591832;14;3.464101615;ellipse;1.52E-01;false;45445;1087;3
113294;3.02E-01;neuron death;14305;70997;18;0.520591832;14;3.464101615;ellipse;1.52E-01;false;70997;1087;3
113379;3.02E-01;negative regulation of peptide secretion;14305;2792;18;0.520591832;14;3.464101615;ellipse;1.52E-01;false;2792;1087;3
113532;3.02E-01;interaction with symbiont;14305;51702;18;0.520591832;14;3.464101615;ellipse;1.52E-01;false;51702;1087;3
116712;3.02E-01;positive regulation of calcium-mediated signaling;14305;50850;18;0.520591832;14;3.464101615;ellipse;1.52E-01;false;50850;1087;3
117890;3.02E-01;myotube differentiation;14305;14902;18;0.520591832;14;3.464101615;ellipse;1.52E-01;false;14902;1087;3
118716;3.02E-01;rRNA transcription;14305;9303;18;0.520591832;14;3.464101615;ellipse;1.52E-01;false;9303;1087;3
118831;3.02E-01;DNA catabolic process, endonucleolytic;14305;737;18;0.520591832;14;3.464101615;ellipse;1.52E-01;false;737;1087;3
119672;3.02E-01;DNA fragmentation involved in apoptotic nuclear change;14305;6309;18;0.520591832;14;3.464101615;ellipse;1.52E-01;false;6309;1087;3
120734;3.02E-01;pattern recognition receptor signaling pathway;14305;2221;18;0.520591832;14;3.464101615;ellipse;1.52E-01;false;2221;1087;3
118013;3.04E-01;small molecule catabolic process;14305;44282;265;0.517609598;14;10;ellipse;1.54E-01;false;44282;1087;25
112114;3.05E-01;negative regulation of developmental process;14305;51093;289;0.515916566;14;10.39230485;ellipse;1.54E-01;false;51093;1087;27
118848;3.05E-01;RNA elongation from RNA polymerase II promoter;14305;6368;48;0.515524252;14;4.898979486;ellipse;1.54E-01;false;6368;1087;6
111861;3.13E-01;positive regulation of JUN kinase activity;14305;43507;38;0.504320661;14;4.472135955;ellipse;1.59E-01;false;43507;1087;5
115313;3.13E-01;epithelial cell development;14305;2064;38;0.504320661;14;4.472135955;ellipse;1.59E-01;false;2064;1087;5
112684;3.14E-01;purine nucleotide metabolic process;14305;6163;172;0.502388624;14;8.246211251;ellipse;1.60E-01;false;6163;1087;17
115658;3.14E-01;branching involved in ureteric bud morphogenesis;14305;1658;28;0.502388624;14;4;ellipse;1.60E-01;false;1658;1087;4
118851;3.14E-01;positive regulation of oxidoreductase activity;14305;51353;28;0.502388624;14;4;ellipse;1.60E-01;false;51353;1087;4
119156;3.14E-01;salivary gland development;14305;7431;28;0.502388624;14;4;ellipse;1.60E-01;false;7431;1087;4
118130;3.26E-01;response to corticosteroid stimulus;14305;31960;104;0.48687833;14;6.633249581;ellipse;1.66E-01;false;31960;1087;11
118517;3.26E-01;protein homooligomerization;14305;51260;104;0.48687833;14;6.633249581;ellipse;1.66E-01;false;51260;1087;11
110992;3.35E-01;positive regulation of developmental growth;14305;48639;19;0.474415299;14;3.464101615;ellipse;1.71E-01;false;48639;1087;3
111685;3.35E-01;regulation of interleukin-2 biosynthetic process;14305;45076;19;0.474415299;14;3.464101615;ellipse;1.71E-01;false;45076;1087;3
112208;3.35E-01;positive regulation of Ras protein signal transduction;14305;46579;19;0.474415299;14;3.464101615;ellipse;1.71E-01;false;46579;1087;3
112697;3.35E-01;cerebellum morphogenesis;14305;21587;19;0.474415299;14;3.464101615;ellipse;1.71E-01;false;21587;1087;3
113621;3.35E-01;interaction with host;14305;51701;39;0.474415299;14;4.472135955;ellipse;1.71E-01;false;51701;1087;5
114610;3.35E-01;positive regulation of Wnt receptor signaling pathway;14305;30177;19;0.474415299;14;3.464101615;ellipse;1.71E-01;false;30177;1087;3
115475;3.35E-01;purine ribonucleoside monophosphate metabolic process;14305;9167;19;0.474415299;14;3.464101615;ellipse;1.71E-01;false;9167;1087;3
115512;3.35E-01;myeloid leukocyte mediated immunity;14305;2444;19;0.474415299;14;3.464101615;ellipse;1.71E-01;false;2444;1087;3
117061;3.35E-01;intermediate filament cytoskeleton organization;14305;45104;19;0.474415299;14;3.464101615;ellipse;1.71E-01;false;45104;1087;3
119369;3.35E-01;regulation of tissue remodeling;14305;34103;19;0.474415299;14;3.464101615;ellipse;1.71E-01;false;34103;1087;3
120007;3.35E-01;purine nucleoside monophosphate metabolic process;14305;9126;19;0.474415299;14;3.464101615;ellipse;1.71E-01;false;9126;1087;3
111161;3.37E-01;positive regulation of heat generation;14305;31652;10;0.472778704;14;2.828427125;ellipse;1.73E-01;false;31652;1087;2
111500;3.37E-01;myeloid dendritic cell activation;14305;1773;10;0.472778704;14;2.828427125;ellipse;1.73E-01;false;1773;1087;2
112512;3.37E-01;activation of Rho GTPase activity;14305;32862;10;0.472778704;14;2.828427125;ellipse;1.73E-01;false;32862;1087;2
112590;3.37E-01;male sex determination;14305;30238;10;0.472778704;14;2.828427125;ellipse;1.73E-01;false;30238;1087;2
113583;3.37E-01;lens fiber cell differentiation;14305;70306;10;0.472778704;14;2.828427125;ellipse;1.73E-01;false;70306;1087;2
113634;3.37E-01;mitotic cell cycle spindle assembly checkpoint;14305;7094;10;0.472778704;14;2.828427125;ellipse;1.73E-01;false;7094;1087;2
113685;3.37E-01;positive regulation of epithelial cell migration;14305;10634;10;0.472778704;14;2.828427125;ellipse;1.73E-01;false;10634;1087;2
114034;3.37E-01;response to hyperoxia;14305;55093;10;0.472778704;14;2.828427125;ellipse;1.73E-01;false;55093;1087;2
115279;3.37E-01;regulation of heat generation;14305;31650;10;0.472778704;14;2.828427125;ellipse;1.73E-01;false;31650;1087;2
115445;3.37E-01;regulation of microtubule polymerization;14305;31113;10;0.472778704;14;2.828427125;ellipse;1.73E-01;false;31113;1087;2
116434;3.37E-01;regulation of macrophage differentiation;14305;45649;10;0.472778704;14;2.828427125;ellipse;1.73E-01;false;45649;1087;2
118712;3.37E-01;B cell receptor signaling pathway;14305;50853;10;0.472778704;14;2.828427125;ellipse;1.73E-01;false;50853;1087;2
119357;3.37E-01;positive regulation of smooth muscle cell migration;14305;14911;10;0.472778704;14;2.828427125;ellipse;1.73E-01;false;14911;1087;2
112456;3.39E-01;positive regulation of GTPase activity;14305;43547;29;0.469388908;14;4;ellipse;1.75E-01;false;43547;1087;4
113260;3.39E-01;lactation;14305;7595;29;0.469388908;14;4;ellipse;1.75E-01;false;7595;1087;4
116295;3.39E-01;positive regulation of peptide hormone secretion;14305;90277;29;0.469388908;14;4;ellipse;1.75E-01;false;90277;1087;4
112095;3.43E-01;regulation of striated muscle tissue development;14305;16202;50;0.464508121;14;4.898979486;ellipse;1.77E-01;false;16202;1087;6
112257;3.44E-01;positive regulation of defense response;14305;31349;83;0.462992531;14;6;ellipse;1.78E-01;false;31349;1087;9
112962;3.44E-01;male sex differentiation;14305;46661;83;0.462992531;14;6;ellipse;1.78E-01;false;46661;1087;9
117258;3.44E-01;positive regulation of MAPKKK cascade;14305;43410;83;0.462992531;14;6;ellipse;1.78E-01;false;43410;1087;9
113672;3.47E-01;wound healing;14305;42060;199;0.459167366;14;8.717797887;ellipse;1.79E-01;false;42060;1087;19
117042;3.57E-01;nucleic acid phosphodiester bond hydrolysis;14305;90305;40;0.447319961;14;4.472135955;ellipse;1.84E-01;false;90305;1087;5
118257;3.57E-01;peripheral nervous system development;14305;7422;40;0.447319961;14;4.472135955;ellipse;1.84E-01;false;7422;1087;5
112748;3.61E-01;regulation of muscle system process;14305;90257;84;0.442855849;14;6;ellipse;1.87E-01;false;90257;1087;9
121572;3.61E-01;phosphoinositide-mediated signaling;14305;48015;84;0.442855849;14;6;ellipse;1.87E-01;false;48015;1087;9
111767;3.64E-01;regulation of chemotaxis;14305;50920;51;0.439131724;14;4.898979486;ellipse;1.88E-01;false;50920;1087;6
115960;3.64E-01;regulation of muscle organ development;14305;48634;51;0.439131724;14;4.898979486;ellipse;1.88E-01;false;48634;1087;6
118847;3.64E-01;RNA elongation;14305;6354;51;0.439131724;14;4.898979486;ellipse;1.88E-01;false;6354;1087;6
110994;3.65E-01;regulation of muscle contraction;14305;6937;74;0.437727025;14;5.656854249;ellipse;1.98E-01;false;6937;1087;8
111001;3.65E-01;cellular response to organic cyclic substance;14305;71407;3;0.437727025;14;2;ellipse;2.11E-01;false;71407;1087;1
111036;3.65E-01;lysosome localization;14305;32418;3;0.437727025;14;2;ellipse;2.11E-01;false;32418;1087;1
111041;3.65E-01;diadenosine polyphosphate metabolic process;14305;15959;3;0.437727025;14;2;ellipse;2.11E-01;false;15959;1087;1
111048;3.65E-01;oocyte differentiation;14305;9994;21;0.437727025;14;3.464101615;ellipse;2.11E-01;false;9994;1087;3
111145;3.65E-01;regulation of JNK cascade;14305;46328;74;0.437727025;14;5.656854249;ellipse;1.98E-01;false;46328;1087;8
111251;3.65E-01;regulation of Rho GTPase activity;14305;32319;30;0.437727025;14;4;ellipse;1.90E-01;false;32319;1087;4
111254;3.65E-01;reproductive process in a multicellular organism;14305;48609;511;0.437727025;14;13.26649916;ellipse;2.11E-01;false;48609;1087;44
111264;3.65E-01;embryonic neurocranium morphogenesis;14305;48702;3;0.437727025;14;2;ellipse;2.11E-01;false;48702;1087;1
111313;3.65E-01;prostate gland morphogenetic growth;14305;60737;3;0.437727025;14;2;ellipse;2.11E-01;false;60737;1087;1
111328;3.65E-01;positive regulation of translational elongation;14305;45901;3;0.437727025;14;2;ellipse;2.11E-01;false;45901;1087;1
111339;3.65E-01;negative regulation of low-density lipoprotein receptor biosynthetic process;14305;45715;3;0.437727025;14;2;ellipse;2.11E-01;false;45715;1087;1
111349;3.65E-01;glucuronate biosynthetic process;14305;46399;3;0.437727025;14;2;ellipse;2.11E-01;false;46399;1087;1
111350;3.65E-01;UDP-glucuronate biosynthetic process;14305;6065;3;0.437727025;14;2;ellipse;2.11E-01;false;6065;1087;1
111353;3.65E-01;early endosome to late endosome transport;14305;45022;11;0.437727025;14;2.828427125;ellipse;2.01E-01;false;45022;1087;2
111473;3.65E-01;positive regulation of necroptosis;14305;60545;3;0.437727025;14;2;ellipse;2.11E-01;false;60545;1087;1
111474;3.65E-01;induction of necroptosis;14305;60553;3;0.437727025;14;2;ellipse;2.11E-01;false;60553;1087;1
111503;3.65E-01;negative regulation of nuclear mRNA splicing, via spliceosome;14305;48025;3;0.437727025;14;2;ellipse;2.11E-01;false;48025;1087;1
111564;3.65E-01;regulation of axonogenesis;14305;50770;63;0.437727025;14;5.291502622;ellipse;2.00E-01;false;50770;1087;7
111581;3.65E-01;regulation of meiotic cell cycle;14305;51445;11;0.437727025;14;2.828427125;ellipse;2.01E-01;false;51445;1087;2
111590;3.65E-01;negative regulation of activated T cell proliferation;14305;46007;3;0.437727025;14;2;ellipse;2.11E-01;false;46007;1087;1
111596;3.65E-01;pyrimidine ribonucleoside triphosphate metabolic process;14305;9208;11;0.437727025;14;2.828427125;ellipse;2.01E-01;false;9208;1087;2
111661;3.65E-01;serine phosphorylation of STAT protein;14305;42501;3;0.437727025;14;2;ellipse;2.11E-01;false;42501;1087;1
111703;3.65E-01;regulation of defense response to virus;14305;50688;21;0.437727025;14;3.464101615;ellipse;2.11E-01;false;50688;1087;3
111747;3.65E-01;asparagine metabolic process;14305;6528;3;0.437727025;14;2;ellipse;2.11E-01;false;6528;1087;1
111766;3.65E-01;regulation of response to external stimulus;14305;32101;191;0.437727025;14;8.485281374;ellipse;2.02E-01;false;32101;1087;18
111784;3.65E-01;vitamin B6 metabolic process;14305;42816;3;0.437727025;14;2;ellipse;2.11E-01;false;42816;1087;1
111815;3.65E-01;regulation of growth hormone receptor signaling pathway;14305;60398;3;0.437727025;14;2;ellipse;2.11E-01;false;60398;1087;1
111850;3.65E-01;T cell proliferation involved in immune response;14305;2309;3;0.437727025;14;2;ellipse;2.11E-01;false;2309;1087;1
111882;3.65E-01;activation of innate immune response;14305;2218;21;0.437727025;14;3.464101615;ellipse;2.11E-01;false;2218;1087;3
111915;3.65E-01;His-Purkinje system development;14305;3164;3;0.437727025;14;2;ellipse;2.11E-01;false;3164;1087;1
111944;3.65E-01;organelle fusion;14305;48284;20;0.437727025;14;3.464101615;ellipse;1.91E-01;false;48284;1087;3
111958;3.65E-01;regulation of vesicle-mediated transport;14305;60627;121;0.437727025;14;6.92820323;ellipse;2.08E-01;false;60627;1087;12
111960;3.65E-01;bundle of His development;14305;3166;3;0.437727025;14;2;ellipse;2.11E-01;false;3166;1087;1
111988;3.65E-01;muscle contraction;14305;6936;154;0.437727025;14;7.745966692;ellipse;1.93E-01;false;6936;1087;15
112009;3.65E-01;positive regulation of small GTPase mediated signal transduction;14305;51057;20;0.437727025;14;3.464101615;ellipse;1.91E-01;false;51057;1087;3
112014;3.65E-01;T cell costimulation;14305;31295;11;0.437727025;14;2.828427125;ellipse;2.01E-01;false;31295;1087;2
112035;3.65E-01;positive regulation of sulfur metabolic process;14305;51176;3;0.437727025;14;2;ellipse;2.11E-01;false;51176;1087;1
112039;3.65E-01;monovalent inorganic anion homeostasis;14305;55083;3;0.437727025;14;2;ellipse;2.11E-01;false;55083;1087;1
112040;3.65E-01;cellular monovalent inorganic anion homeostasis;14305;30320;3;0.437727025;14;2;ellipse;2.11E-01;false;30320;1087;1
112045;3.65E-01;heparin biosynthetic process;14305;30210;3;0.437727025;14;2;ellipse;2.11E-01;false;30210;1087;1
112051;3.65E-01;post-embryonic camera-type eye development;14305;31077;3;0.437727025;14;2;ellipse;2.11E-01;false;31077;1087;1
112070;3.65E-01;peptidyl-proline hydroxylation;14305;19511;3;0.437727025;14;2;ellipse;2.11E-01;false;19511;1087;1
112071;3.65E-01;peptidyl-proline hydroxylation to 4-hydroxy-L-proline;14305;18401;3;0.437727025;14;2;ellipse;2.11E-01;false;18401;1087;1
112124;3.65E-01;cardiac conduction system development;14305;3161;3;0.437727025;14;2;ellipse;2.11E-01;false;3161;1087;1
112166;3.65E-01;replication fork protection;14305;48478;3;0.437727025;14;2;ellipse;2.11E-01;false;48478;1087;1
112183;3.65E-01;olfactory placode formation;14305;30910;3;0.437727025;14;2;ellipse;2.11E-01;false;30910;1087;1
112288;3.65E-01;UDP-glucose metabolic process;14305;6011;3;0.437727025;14;2;ellipse;2.11E-01;false;6011;1087;1
112335;3.65E-01;positive regulation of transcription from RNA polymerase II promoter, global;14305;45817;3;0.437727025;14;2;ellipse;2.11E-01;false;45817;1087;1
112422;3.65E-01;virus-infected cell apoptosis;14305;6926;3;0.437727025;14;2;ellipse;2.11E-01;false;6926;1087;1
112474;3.65E-01;purine nucleotide transport;14305;15865;3;0.437727025;14;2;ellipse;2.11E-01;false;15865;1087;1
112487;3.65E-01;proteasome regulatory particle assembly;14305;70682;3;0.437727025;14;2;ellipse;2.11E-01;false;70682;1087;1
112536;3.65E-01;regulation of mitochondrial membrane potential;14305;51881;11;0.437727025;14;2.828427125;ellipse;2.01E-01;false;51881;1087;2
112539;3.65E-01;glucose import;14305;46323;3;0.437727025;14;2;ellipse;2.11E-01;false;46323;1087;1
112548;3.65E-01;regulation of inositol phosphate biosynthetic process;14305;10919;3;0.437727025;14;2;ellipse;2.11E-01;false;10919;1087;1
112550;3.65E-01;positive regulation of axonogenesis;14305;50772;31;0.437727025;14;4;ellipse;2.06E-01;false;50772;1087;4
112554;3.65E-01;stress-activated protein kinase signaling cascade;14305;31098;63;0.437727025;14;5.291502622;ellipse;2.00E-01;false;31098;1087;7
112650;3.65E-01;pyrimidine ribonucleoside triphosphate biosynthetic process;14305;9209;11;0.437727025;14;2.828427125;ellipse;2.01E-01;false;9209;1087;2
112659;3.65E-01;positive regulation of proteasomal ubiquitin-dependent protein catabolic process;14305;32436;20;0.437727025;14;3.464101615;ellipse;1.91E-01;false;32436;1087;3
112700;3.65E-01;regulation of interleukin-5 production;14305;32674;3;0.437727025;14;2;ellipse;2.11E-01;false;32674;1087;1
112725;3.65E-01;branching involved in prostate gland morphogenesis;14305;60442;11;0.437727025;14;2.828427125;ellipse;2.01E-01;false;60442;1087;2
112775;3.65E-01;regulation of interleukin-12 production;14305;32655;21;0.437727025;14;3.464101615;ellipse;2.11E-01;false;32655;1087;3
112782;3.65E-01;regulation of interleukin-13 production;14305;32656;3;0.437727025;14;2;ellipse;2.11E-01;false;32656;1087;1
112796;3.65E-01;DNA methylation involved in embryonic development;14305;43045;3;0.437727025;14;2;ellipse;2.11E-01;false;43045;1087;1
112810;3.65E-01;heart induction;14305;3129;3;0.437727025;14;2;ellipse;2.11E-01;false;3129;1087;1
112811;3.65E-01;endodermal-mesodermal cell signaling involved in heart induction;14305;3134;3;0.437727025;14;2;ellipse;2.11E-01;false;3134;1087;1
112971;3.65E-01;neural fold formation;14305;1842;3;0.437727025;14;2;ellipse;2.11E-01;false;1842;1087;1
113007;3.65E-01;regulation of diuresis;14305;3074;3;0.437727025;14;2;ellipse;2.11E-01;false;3074;1087;1
113083;3.65E-01;maturation of SSU-rRNA;14305;30490;3;0.437727025;14;2;ellipse;2.11E-01;false;30490;1087;1
113089;3.65E-01;negative regulation of striated muscle cell apoptosis;14305;10664;3;0.437727025;14;2;ellipse;2.11E-01;false;10664;1087;1
113130;3.65E-01;odontogenesis;14305;42476;64;0.437727025;14;5.291502622;ellipse;2.11E-01;false;42476;1087;7
113149;3.65E-01;negative regulation of synaptogenesis;14305;51964;3;0.437727025;14;2;ellipse;2.11E-01;false;51964;1087;1
113152;3.65E-01;skeletal muscle myosin thick filament assembly;14305;30241;3;0.437727025;14;2;ellipse;2.11E-01;false;30241;1087;1
113166;3.65E-01;L-serine catabolic process;14305;6565;3;0.437727025;14;2;ellipse;2.11E-01;false;6565;1087;1
113178;3.65E-01;muscle system process;14305;3012;168;0.437727025;14;8;ellipse;2.07E-01;false;3012;1087;16
113219;3.65E-01;cytokine production involved in immune response;14305;2367;3;0.437727025;14;2;ellipse;2.11E-01;false;2367;1087;1
113227;3.65E-01;positive regulation of NK T cell differentiation;14305;51138;3;0.437727025;14;2;ellipse;2.11E-01;false;51138;1087;1
113242;3.65E-01;prostate glandular acinus development;14305;60525;11;0.437727025;14;2.828427125;ellipse;2.01E-01;false;60525;1087;2
113328;3.65E-01;mitochondrion organization;14305;7005;131;0.437727025;14;7.211102551;ellipse;1.95E-01;false;7005;1087;13
113337;3.65E-01;positive regulation of peptide secretion;14305;2793;30;0.437727025;14;4;ellipse;1.90E-01;false;2793;1087;4
113426;3.65E-01;oocyte development;14305;48599;20;0.437727025;14;3.464101615;ellipse;1.91E-01;false;48599;1087;3
113440;3.65E-01;positive regulation of sarcomere organization;14305;60298;3;0.437727025;14;2;ellipse;2.11E-01;false;60298;1087;1
113530;3.65E-01;striated muscle myosin thick filament assembly;14305;71688;3;0.437727025;14;2;ellipse;2.11E-01;false;71688;1087;1
113566;3.65E-01;positive regulation of mitotic metaphase/anaphase transition;14305;45842;3;0.437727025;14;2;ellipse;2.11E-01;false;45842;1087;1
113592;3.65E-01;negative regulation of RNA polymerase II transcriptional preinitiation complex assembly;14305;17055;3;0.437727025;14;2;ellipse;2.11E-01;false;17055;1087;1
113636;3.65E-01;negative regulation of microtubule polymerization;14305;31115;3;0.437727025;14;2;ellipse;2.11E-01;false;31115;1087;1
113644;3.65E-01;multicellular organism reproduction;14305;32504;511;0.437727025;14;13.26649916;ellipse;2.11E-01;false;32504;1087;44
113688;3.65E-01;negative regulation of hormone biosynthetic process;14305;32353;3;0.437727025;14;2;ellipse;2.11E-01;false;32353;1087;1
113722;3.65E-01;establishment of endothelial barrier;14305;61028;3;0.437727025;14;2;ellipse;2.11E-01;false;61028;1087;1
113724;3.65E-01;negative regulation of hormone metabolic process;14305;32351;3;0.437727025;14;2;ellipse;2.11E-01;false;32351;1087;1
113735;3.65E-01;eye photoreceptor cell differentiation;14305;1754;20;0.437727025;14;3.464101615;ellipse;1.91E-01;false;1754;1087;3
113775;3.65E-01;regulation of cortisol secretion;14305;51462;3;0.437727025;14;2;ellipse;2.11E-01;false;51462;1087;1
113797;3.65E-01;negative regulation of lipopolysaccharide-mediated signaling pathway;14305;31665;3;0.437727025;14;2;ellipse;2.11E-01;false;31665;1087;1
113842;3.65E-01;re-entry into mitotic cell cycle;14305;320;3;0.437727025;14;2;ellipse;2.11E-01;false;320;1087;1
113857;3.65E-01;regulation of TOR signaling cascade;14305;32006;11;0.437727025;14;2.828427125;ellipse;2.01E-01;false;32006;1087;2
113885;3.65E-01;zygotic specification of dorsal/ventral axis;14305;7352;3;0.437727025;14;2;ellipse;2.11E-01;false;7352;1087;1
113891;3.65E-01;purine nucleoside triphosphate catabolic process;14305;9146;11;0.437727025;14;2.828427125;ellipse;2.01E-01;false;9146;1087;2
113895;3.65E-01;STAT protein nuclear translocation;14305;7262;3;0.437727025;14;2;ellipse;2.11E-01;false;7262;1087;1
113989;3.65E-01;positive regulation of heart rate by epinephrine-norepinephrine;14305;1996;3;0.437727025;14;2;ellipse;2.11E-01;false;1996;1087;1
114004;3.65E-01;regulation of vitamin D 24-hydroxylase activity;14305;10979;3;0.437727025;14;2;ellipse;2.11E-01;false;10979;1087;1
114005;3.65E-01;positive regulation of vitamin D 24-hydroxylase activity;14305;10980;3;0.437727025;14;2;ellipse;2.11E-01;false;10980;1087;1
114080;3.65E-01;olfactory placode morphogenesis;14305;71699;3;0.437727025;14;2;ellipse;2.11E-01;false;71699;1087;1
114099;3.65E-01;negative regulation of nervous system development;14305;51961;3;0.437727025;14;2;ellipse;2.11E-01;false;51961;1087;1
114127;3.65E-01;response to glucocorticoid stimulus;14305;51384;97;0.437727025;14;6.32455532;ellipse;2.01E-01;false;51384;1087;10
114147;3.65E-01;negative regulation of endopeptidase activity;14305;10951;3;0.437727025;14;2;ellipse;2.11E-01;false;10951;1087;1
114206;3.65E-01;regulation of release of cytochrome c from mitochondria;14305;90199;3;0.437727025;14;2;ellipse;2.11E-01;false;90199;1087;1
114221;3.65E-01;acetyl-CoA metabolic process;14305;6084;30;0.437727025;14;4;ellipse;1.90E-01;false;6084;1087;4
114271;3.65E-01;lung induction;14305;60492;3;0.437727025;14;2;ellipse;2.11E-01;false;60492;1087;1
114291;3.65E-01;myosin filament assembly;14305;31034;3;0.437727025;14;2;ellipse;2.11E-01;false;31034;1087;1
114325;3.65E-01;epithelial cell proliferation involved in mammary gland duct elongation;14305;60750;3;0.437727025;14;2;ellipse;2.11E-01;false;60750;1087;1
114330;3.65E-01;endodermal-mesodermal cell signaling;14305;3133;3;0.437727025;14;2;ellipse;2.11E-01;false;3133;1087;1
114355;3.65E-01;olfactory placode development;14305;71698;3;0.437727025;14;2;ellipse;2.11E-01;false;71698;1087;1
114358;3.65E-01;regulation of growth rate;14305;40009;3;0.437727025;14;2;ellipse;2.11E-01;false;40009;1087;1
114505;3.65E-01;regulation of integrin biosynthetic process;14305;45113;3;0.437727025;14;2;ellipse;2.11E-01;false;45113;1087;1
114552;3.65E-01;chloride ion homeostasis;14305;55064;3;0.437727025;14;2;ellipse;2.11E-01;false;55064;1087;1
114553;3.65E-01;cellular chloride ion homeostasis;14305;30644;3;0.437727025;14;2;ellipse;2.11E-01;false;30644;1087;1
114563;3.65E-01;venous blood vessel morphogenesis;14305;48845;3;0.437727025;14;2;ellipse;2.11E-01;false;48845;1087;1
114576;3.65E-01;nitric oxide transport;14305;30185;3;0.437727025;14;2;ellipse;2.11E-01;false;30185;1087;1
114581;3.65E-01;pigment accumulation;14305;43476;3;0.437727025;14;2;ellipse;2.11E-01;false;43476;1087;1
114706;3.65E-01;negative regulation of complement activation;14305;45916;3;0.437727025;14;2;ellipse;2.11E-01;false;45916;1087;1
114714;3.65E-01;positive regulation of insulin receptor signaling pathway;14305;46628;3;0.437727025;14;2;ellipse;2.11E-01;false;46628;1087;1
114744;3.65E-01;regulation of macrophage activation;14305;43030;11;0.437727025;14;2.828427125;ellipse;2.01E-01;false;43030;1087;2
114762;3.65E-01;translational termination;14305;6415;3;0.437727025;14;2;ellipse;2.11E-01;false;6415;1087;1
114840;3.65E-01;intracellular mRNA localization;14305;8298;3;0.437727025;14;2;ellipse;2.11E-01;false;8298;1087;1
114856;3.65E-01;response to glucose stimulus;14305;9749;62;0.437727025;14;5.291502622;ellipse;1.89E-01;false;9749;1087;7
114861;3.65E-01;serotonin secretion;14305;1820;3;0.437727025;14;2;ellipse;2.11E-01;false;1820;1087;1
114906;3.65E-01;urate metabolic process;14305;46415;3;0.437727025;14;2;ellipse;2.11E-01;false;46415;1087;1
114976;3.65E-01;maintenance of DNA methylation;14305;10216;3;0.437727025;14;2;ellipse;2.11E-01;false;10216;1087;1
115028;3.65E-01;regulation of striated muscle cell apoptosis;14305;10662;3;0.437727025;14;2;ellipse;2.11E-01;false;10662;1087;1
115049;3.65E-01;negative regulation of cytokine-mediated signaling pathway;14305;1960;11;0.437727025;14;2.828427125;ellipse;2.01E-01;false;1960;1087;2
115080;3.65E-01;inositol phosphate biosynthetic process;14305;32958;3;0.437727025;14;2;ellipse;2.11E-01;false;32958;1087;1
115130;3.65E-01;homocysteine metabolic process;14305;50667;3;0.437727025;14;2;ellipse;2.11E-01;false;50667;1087;1
